sentence,property,topic,vehicle,event,option0,option1,option2,option3,ans_idx
Richard had only been climbing a few months but he was as _ as an ox and had no respect for tradition he did n't know all the horror stories,strong,he,ox,was,strong,weak,slow,old,0
The haul up from there to the top of the highest bank was several hundred feet of deep heather pollen - dusty and honey - scented but as _ as a hedgehog for a flea,friendly,haul,hedgehog,but,hazardous,hostile,friendly,human,2
To say that human beings from time to time have sexual intercourse and that this is because they have sexual instincts is as _ as the argument about hunger,circular,instincts,hunger,is,circular,cold,maternal,square,0
As soon as he is shipped on board of a man - of - war he becomes as _ as a midshipman must unavoidably be from his humble situation,insignificant,he,midshipman,becomes,important,involved,significant,insignificant,3
His tip is ponderously broad half the size of the cue - ball mine is as _ as a sting excellent for spins and miscues,slender,mine,sting,is,painful,sudden,slender,sharp,2
Though you may wish to insist it is not true the fact remains that Leos are as _ as the stains on a butcher 's tunic,stubborn,Leos,stains,are,stubborn,blue,red,yellow,0
The sparr+A123ows alone with their urchin adaptability have found their snow legs and know already that today the street - bottoms are as _ as the air and that they run no danger from dog or bicycle,safe,bottoms,air,are,unsafe,cool,dangerous,safe,3
But his daughters on whom he is as _ as a baby refuse to get up in what they call the middle of the night to enable him to pursue his observations,dependent,he,baby,is,drunk,independent,dependent,happy,2
People said that she was as _ as the Moor itself and just as changeable,wild,she,Moor,was,wild,hot,tame,green,0
"One moment she could be smiling tenderly as she fed the animals, the next filled with anger and as _ as a tiger at bay",dangerous,she,tiger,be,beautiful,dangerous,hot,safe,1
She had been as _ as a feather to carry and her small hands were as cold as ice,light,She,feather,been,big,light,hot,pretty,1
I 'll be as _ as a coot if you go on like that,bald,I,coot,be,dense,cunning,bald,hungry,2
Shiseido has increased the proportion of the moisturising ingredient hyaluronic acid in the Matte Red Lipstick to give a velvety texture and the three - sided Black Variations Shadow Liner is as _ as charcoal so that it can be blended all over the eyelid or gently smudged as a liner,soft,Liner,liner,is,hard,soft,opaque,lightweight,1
The even strength of his fingers and his robust eloquence James Huneker would never have found the Scherzo from the B minor Sonata which is as _ as a harebell after this and assurance are often awe - inspiring few young pianists have found a more direct path to musical truth or heeded Jorge Bolet 's adage that speed is so often the enemy of excitement,light,Sonata,harebell,is,white,hard,light,lightweight,2
Basically we 're as _ as chalk and cheese and we have completely different life styles for a start I 'm a family man and he 's not,different,we,chalk,'re,normal,rich,nice,different,3
And what a despicable set of values rendered all the more offensive by the revelations from Wall Street London Tokyo and Dublin that the mandarins gurus and executors of capitalism are as _ as a fox guarding a chicken coop,TRUE,gurus,fox,are,red,TRUE,mechanical,spiritual,1
All this may be for the locals but in Cologne you 'll find the welcome extended to visitors is as _ as a schnapps downed in one,warm,welcome,schnapps,is,cool,bitter,warm,very,2
Even Wordsworth who had never been there took it on himself to describe it as _ as the lair where the young lions couch then went on to say that if the pensive votary enters Gordale at shadowy eve when the air glimmers with fading light he or she will meet a local deity with oozey hair and mineral crown,terrific,himself,lair,describe,mere,happy,useful,terrific,3
High lonely hills where the wind and the sound carry and the ground 's as _ as straw in a barn,dry,ground,straw,'s,hard,sweet,dry,wet,2
No wonder they 're all as _ as hares and smell like princes,big,they,hares,'re,black,little,big,old,2
In the eyes of the faithful these Brabanters with their freebooting and lack of discipline after the end of campaigns were as _ as heretics in 1171 Frederick Barbarossa and Louis VII agreed to expel them from their lands,dangerous,Brabanters,heretics,were,TRUE,funny,safe,dangerous,3
I steered clear of Daniel 's murder but he 's as _ as hell in the other case too,guilty,he,hell,'s,innocent,dead,bad,guilty,3
The camp was almost as _ as day but beyond to front and rear stretched the clammy darkness of the Moravian moor,bright,camp,day,was,dark,light,dull,bright,3
Come now and let us reason together saith the Lord though your sins be as scarlet they shall be as _ as snow though they be red like crimson they shall be as wool,white,they,snow,be,cold,heavy,beautiful,white,3
The other friend who also decided to become a lawyer was as _ as an arrow in flight and in total contrast was very conventional in his approach to life,straight,friend,arrow,was,pointed,straight,sharp,crooked,1
The thousands of groups and organisations are as _ as the colours of the rainbow and they have taken this natural phenomenon as the New Age symbol,diverse,organisations,colours,are,important,reflective,helpful,diverse,3
Another rifleman had bartered some of his Red Cross parcel for a loaf of bread The conditions of living and surviving had made us all as _ as foxes so this rifleman that night slept with it under his neck but someone crept up and cut off both the ends,cunning,us,foxes,made,cunning,fun,red,beautiful,0
One lot are as _ as gold we 'll have them any day but another lot are almost more than we can cope with,good,lot,gold,are,valuable,bad,evil,good,3
The pun on Spinoza was too good for Coleridge to resist and the remarkable nose he attributed to Walsh may well have been borrowed from his memories of the innkeeper at the Castle of Comfort on the road from Stowey to Holford his nose which was locally famous was said to be as _ as a fist and well warted,big,nose,fist,be,strong,small,big,long,2
Although the mind - body effects of essences can be verified by science the spiritual dimension is of course elusive as _ as the fragrance of a beautiful flower,celestial,dimension,fragrance,is,endless,celestial,evade,bad,1
And a bubble blew up under the mud and when the bubble was as _ as an elephant it burst and out popped Mrs Dinwiddie,big,bubble,elephant,was,sized,little,big,small,2
She was as _ as a ghost and her eyes were shadowed as if she had n't slept properly for weeks,white,She,ghost,was,beautiful,ugly,white,pretty,2
Penelope Fitzgerald 's prose is as _ as glass and you realise how much she has n't said only when you stop laughing,clear,prose,glass,is,clear,clean,unclear,opaque,0
Those waves are as _ as houses she exclaimed nodding to our right,big,waves,houses,are,big,loud,tall,little,0
I 'm as _ as a whistle they can test me any time anywhere,clean,I,whistle,'m,sharp,clean,dirty,sick,1
But Thomas Carter was from Philadelphia and his love for Oxford and for England was a pure boyish enthusiasm which is as _ as a passion for preserved railways or real ale,innocent,enthusiasm,passion,is,guilty,fun,destructive,innocent,3
With the upstart Parsons that margin was as _ as a motorway of course but even Thomas Carter Nature 's gentleman could n't help getting it ever so slightly wrong in his case by bending over backwards to minimize his achievements and rubbish his accomplishments in order to spare you the painful comparison with your own lacklustre status,wide,margin,motorway,was,wide,sharp,narrow,thin,0
Some have hearing which is so acute that they can detect insects as _ as a midge up to 60 feet away,tiny,insects,midge,detect,huge,tiny,small,hard,1
It is as _ as a galaxy itself and may be the original material of a potential star system that never really formed says Terzian,large,It,galaxy,is,small,spiral,large,dwarf,2
From the mini weighing as _ as an amoeba or only one hundred - millionth of a kilogram kg to the supermassive with a mass one thousand million times that of the Sun they have been invoked to account for a wide range of cosmic phenomena,little,weighing,amoeba,weighing,little,slow,much,big,0
Some regard what they do simply as a form of legitimate adult play while others take it far more seriously and see themselves as going beyond present human limitations journeying into a new galaxy of knowledge in a way which they find at least as _ as the exploration of deep space,exciting,way,exploration,find,fun,important,dangerous,exciting,3
An interferometer swung around by the Earth 's rotation will synthesise a dish as _ as the separation of the two telescopes,large,dish,separation,synthesise,large,square,difficult,small,0
Sir John Anderson who had much to do with atomic weapons development said he was as _ as the flames of Hell,red,he,flames,was,yellow,orange,red,blue,2
And while they certainly are open to research and development and to further invention the way they evolve is as _ as the evolution of the natural world,complex,way,evolution,is,social,rapid,simple,complex,3
I was as _ as a pig in shit,happy,I,pig,was,sad,thirsty,unhappy,happy,3
I was as _ as a poker and as red - hot with pain,stiff,I,hot,was,hungry,stiff,cold,white,1
It was as _ as a caress and Violet could only squirm,good,It,caress,was,evil,bad,good,nice,2
Bryan Gould is as _ as gold and Gerald Kaufman is a happy - go - lucky bachelor who 's still waiting for the right girl to come along,good,Gould,gold,is,ill,pure,bad,good,3
His brain becomes as _ as cheese .,soft,brain,cheese,becomes,hard,white,soft,slow,2
They 're not quite as _ as an onion but have a nice bite to them .,strong,They,onion,'re,strong,old,weak,sweet,0
"They were rough , I remember , incredibly tough , as _ as a carpenter 's vice .",strong,They,vice,were,old,strong,tight,weak,1
They may start out as _ as a grain of salt and grow to be as large as a grapefruit .,small,They,grapefruit,start,slow,big,small,large,2
"In the Bible there is be as _ as snow "" ( Isaiah 1:18 ) .",white,Bible,snow,be,fresh,beautiful,slippery,white,3
Rats ( at least in the RVN ) are bigger and just as _ as squirrels .,smart,Rats,squirrels,are,smart,bright,poisonous,stupid,0
"At a time when spare tax dollars are as _ as cougars in Ontario , the commissioner is concerned that it 's a sign the government does n't intend to do much on the ground .",rare,dollars,cougars,are,rare,few,worthless,beautiful,0
"Her cousin had shrunk into a corner of the settle , as _ as a mouse , congratulating himself , I dare say , that the correction had alighted on another than him .",quiet,cousin,mouse,shrunk,slow,stupid,quiet,loud,2
"These can be as _ as dancing , as useful and low impact as bicycling , or as heart - thumping as boxing .",enjoyable,These,boxing,be,fun,dangerous,painful,enjoyable,3
"It may not be as _ as JonBound , but he promises to get revenge someday ... The next patch is actually a unique one .",complete,It,JonBound,be,slow,incomplete,complete,square,2
"Moving an appliance as _ as a fridge , washing machine or tumble dryer on a frequent basis to give them a good vacuum just is n't practical .",heavy,appliance,fridge,Moving,heavy,ancient,fast,light,0
"Historically , colonialism , and now capitalism , have contributed to the demonization and trivialization of these practices which are as savage , paganistic , hippy dippy and about as _ as a placebo - the way this is presented is like these are novel ideas that were introduced to the world thanks to good ol Edgar .",useful,colonialism,placebo,are,useless,useful,important,other,1
Makes tools that are about as _ as wood .,effective,tools,wood,are,useful,effective,ineffective,edible,1
"He can sow an idea , which is as _ as gunshots or close - hand combat , which he s masterful in .",powerful,idea,gunshots,is,dangerous,useful,powerful,loud,2
"The Bucket Hat Functionally , it 's as _ as a hat that you can stash away into your back pocket for rain or shine .",simple,it,hat,'s,complex,simple,old,subtle,1
They 're not as _ as grass for high - traffic areas .,durable,They,grass,'re,dry,vulnerable,durable,weak,2
"Clayton Speers , 30 , had a 10 - cm buck knife plunged into his neck - out of the blue , as _ as rain from a cloudless sky - while he was simply questioning the 48 - year - old Melton about the erratic behaviour that was troubling Sunday shoppers and diners along Bayfield Ave .",unexpected,knife,rain,plunged,dangerous,expected,unexpected,fatal,2
"When the gluttony was done and all the half - eaten food had been cleared away to be given to the poor who gathered below , at the queen 's insistence tall glass flutes were filled with a spiced liqueur from Qarth which is as _ as amber .",dark,liqueur,amber,is,dark,orange,light,green,0
"You have a gorgeous day this month in June 26 , and it is as _ as diamonds if you have a meeting or presentation on this day or take any other chance on hitting it big , you can make it !",rare,it,diamonds,is,rare,expensive,precious,valuable,0
""" 13 Hence , a man knows something ( statement G ) which the computer can not know and the conclusion is that a computer can not be as _ as a man , even in principle .",intelligent,computer,man,be,expensive,old,intelligent,stupid,2
"Proprietary vendors try to identify customer needs using marketing departments , but there 's little evidence that marketing departments are as _ as customers themselves at identifying customer needs .",effective,departments,customers,are,friendly,ineffective,important,effective,3
"As soon as I figured out that one of my life goals is to support people and make them feel good , I automatically felt as _ as a lion !",brave,I,lion,felt,wild,thirsty,afraid,brave,3
""" His eyes were as _ as saucers now .",wide,eyes,saucers,were,wide,open,narrow,green,0
"The idea of gathering around food is a tradition as _ as time , and Ayurveda recognizes that this is not only a physical process , but also an emotional and spiritual one .",old,idea,time,is,young,old,long,new,1
""" And in the age of social media dominance , shares are just as _ as clicks .",important,shares,clicks,are,away,insignificant,important,enough,2
Some people add sour cream and butter to make it as _ as a cloud and that 's what it literally tastes like .,fluffy,it,cloud,make,beautiful,fluffy,transparent,white,1
"Motif A motif could be something as _ as a design on a Tee shirt , or it can be a theme in writing or music .",simple,motif,design,be,simple,complex,common,subtle,0
"The perfect pair of old beaten - up jeans look pretty badass and what 's more , they 're about as _ as a pair of sweats .",comfortable,they,pair,'re,comfortable,new,different,uncomfortable,0
"This is you , who have been as _ as an eel this last month , and as thorny as a briar - rose ?",slippery,who,rose,been,romantic,sticky,slippery,quick,2
"The red men , who are as silent and as _ as serpents , follow him everywhere and mark his every step .",muscular,men,serpents,are,dense,muscular,poisonous,male,1
"Also , upon word Homolka had moved to an island his comment to a reporter was , "" What can we do about it , she is as _ as a bird .",free,she,bird,is,bound,cunning,free,fly,2
A simple card or a heartfelt note is as _ as a sweater or new pair of socks .,important,card,sweater,is,fun,important,small,insignificant,1
"' And sliding from the bed before I could hinder her , she crossed the room , walking very uncertainly , threw it back , and bent out , careless of the frosty air that cut about her shoulders as _ as a knife .",keen,that,knife,cut,keen,dangerous,free,dull,0
"Some types are as _ as a thumb , and yet can flying hundreds of miles over land and sea to migrate each year .",small,types,thumb,are,large,long,big,small,3
Any child would love to swing as _ as a bird on this lovely indoor / outdoor swing .,free,child,bird,swing,free,first,fun,fly,0
""" And since for the next four days you 're going to be about as _ as a turnip , there 's not much you can do about it , "" he tells Swamp Thing .",dangerous,you,turnip,be,dangerous,safe,green,red,0
"Everybody is aware of the fact that the module Spektr is as _ as a doornail , but the power shortage also paralysed another 2 huge modules , i.e. Kristall and Priroda .",dead,Spektr,doornail,is,live,sharp,alive,dead,3
They may be as _ as URLs in a few years .,common,They,URLs,be,personal,uncommon,rare,common,3
""" as he spoke he smiled , and the lamplight fell on a hardlooking mouth , with very red lips and sharp - looking teeth , which is as _ as ivory .",white,teeth,ivory,is,smooth,yellow,pink,white,3
It was as _ as a sea - gull 's egg .,large,It,egg,was,large,black,small,green,0
Our darling girl is as _ as sugar and has a face that you can not resist .,sweet,girl,sugar,is,sweet,bitter,delicious,hot,0
""" It was as _ as a block of marble .",cold,It,block,was,concrete,hot,cold,small,2
"Silphium uses notes of frankincense , myrrh , leather and tobacco to echo silphium , a herb considered as _ as gold in ancient times .",valuable,herb,gold,considered,useful,worthless,valuable,important,2
"We are portrayed as _ as steel , to a not small degree because the eyes of humans can not see our color and see us only as gray , steel gray .",cold,eyes,gray,portrayed,blue,brown,cold,hot,2
she was not at all shy but she was as _ as a flower ;,sensitive,she,flower,was,cunning,colorful,resistant,sensitive,3
""" The goal may be the same for most people who work with a debt consolidation agency , but someone 's financial situation and needs can be as _ as a fingerprint in my opinion .",unique,situation,fingerprint,be,unique,similar,common,reflective,0
The Struckout jacket does n't restrict movement on the bike and it 's as _ as a feather but if the rain was really hammering down it would n't be too long before you were starting to get wet on the inside .,light,it,feather,'s,good,hard,light,reflective,2
"They are not as _ as curses , but are still considered minor dark magic and are therefore not taught at Hogwarts .",harmful,They,curses,are,harmless,harmful,offensive,beneficial,1
They were as _ as night and day .,different,They,night,were,normal,alike,different,like,2
"The formula will be richer than a gel , but not as _ as a cream .",rich,formula,cream,be,complex,rich,white,sweet,1
"Although I said earlier , with Venus in that house of office and work atmosphere , your relationship with co-workers will likely be as _ as silk , in all the days near February 26 , you do have to be careful about what you say , or how you say it , lest someone overreacts by having a meltdown .",smooth,atmosphere,silk,be,smooth,white,organic,soft,0
"By the time I started paddling through Lilypad , the overcast had completely burnt off and the wind had died , leaving the water as _ as glass .",smooth,I,glass,leaving,smooth,uneven,clean,rough,0
"The phenomenal geothermal wonder of those pictures stayed with me , especially a geothermal pool called Bloody Pond Hell , a pool which was as _ as blood .",red,pool,blood,was,pink,black,liquid,red,3
They generally are more outgoing and not as _ as balls .,shy,They,balls,are,confident,shy,bold,visible,1
""" Morrison believes that action is as _ as beliefs so he is standing in the upcoming TCDSB trustee by - election in North East Scarborough .",important,action,beliefs,is,important,political,dangerous,insignificant,0
"Like the song says , Beauty and the Beast is a tale as _ as time ' .",old,song,time,is,new,old,long,young,1
"he opened the gate himself and sauntered slowly up , probably enjoying the lovely afternoon that breathed as _ as summer .",soft,that,summer,breathed,slow,heavy,soft,loud,2
This active ingredient means it is just as _ as a pain reliever as some over-the-counter painkillers .,effective,it,painkillers,is,effective,bad,limited,ineffective,0
I got one response back that a letter from home is just as _ as a package .,good,letter,package,is,fun,good,bad,whole,1
I doubt many of us can say our situation is as _ as a slaves in the first century .,dire,situation,slaves,is,unpredictable,poor,dire,evil,2
The story of King Arthur and his knights is a tale as _ as time .,old,story,time,is,young,old,new,long,1
"Seven tells him that remorse is as _ as anger , and he says he knows .",unbearable,remorse,anger,is,destructive,unpleasant,unbearable,hot,2
"All you need is a 10 - minute nap and voila , a slurp of rose wine and I feel as _ as a daisy ... "" What I like in being drunk is the moment when you 're alive and enthusiastic .",fresh,I,daisy,feel,fresh,green,ripe,blue,0
"This may be as _ as writing , "" This happens , then this , then that , "" on a sheet of paper , or you might want to write some scenes or topics on index cards and fit them in the correct order before you begin .",simple,This,writing,be,simple,fun,complex,subtle,0
"Mold can be just as _ as bugs , and can be contagious between plants in the same room , and even the same house !",annoying,Mold,bugs,be,annoying,useful,ugly,important,0
The typical life - span of homosexuals suggests that their activities are more destructive than smoking nd as _ as drugs .,dangerous,life,drugs,are,dangerous,safe,complex,bad,0
"The colour of the water , as seen at some distance , was like that of a river which has flowed through a red clay district , but under the shade of the vessel 's side it was quite as _ as chocolate .",dark,it,chocolate,was,dark,brown,warm,light,0
"Hours , incidentally , are as _ as salary and responsibility : it will be your job to hammer out an arrangement that satisfies your needs .",variable,Hours,salary,are,expensive,variable,annual,constant,1
"Before the financial crash in 2008 , UK banks were considered to be as _ as a rock .",stable,banks,rock,be,competitive,unstable,stable,smooth,2
"Not everyone who does it needs / wants to get as _ as a bear , ok ?",big,it,bear,get,small,black,big,good,2
"' Or even if everyone approved , our hope was threatened by war , death or sickness , making it as _ as a sound , swift as a shadow , short as a dream : as brief as lightning in the coal - black night , when it illuminates both heaven and earth in its anger , ' he said .",fleeting,it,lightning,making,fleeting,beautiful,quick,difficult,0
"Airflow is as _ as size , you can install the biggest condenser that will fit , but it can only perform as well as the amount of airflow it receives .",important,Airflow,size,is,dangerous,insignificant,important,small,2
"It 's interesting , however , that when Hollywood uses itself as the framework for a story , it 's never as _ as Spotlight or All The President 's Men .",straightforward,it,Spotlight,'s,free,straightforward,critical,conservative,1
"First of all , with two hit dice at first level and the possibility that gives you of doubling a constitution bonus , the monk is at least as _ as a cleric in hit points , possibly just as _ as a fighter .",strong,monk,fighter,is,young,weak,good,strong,3
Heat tools make our hair more porous than it already is and replenishing that protein is just as _ as moisture .,important,is,moisture,is,insignificant,important,sensitive,extra,1
"More often than not , I get accepted on the basis that I run this blog so my insight is about as _ as a slap in the balls .",relevant,insight,slap,is,interesting,important,irrelevant,relevant,3
"I normally find Dev Patel as _ as a bunch of rocks , but here he gives a rich and soulful turn as a man who just wants his creation to be a good man / robot , and will stop at nothing to engage Chappie 's morality .",bland,I,man,find,thirsty,hungry,bland,happy,2
"he ought to admit that a structure which is even as _ as an eagle 's eye might thus be formed , although in this case he does not know the transitional states .",perfect,he,eye,is,imperfect,perfect,right,faulty,1
"There were four in all and if there 's one thing I have learned about bassists , it 's that they are all as _ as dishwater .",dull,they,dishwater,are,dull,shiny,sharp,intelligent,0
""" My father , "" he said , "" you have made my heart as _ as milk .",white,father,milk,made,black,fresh,fun,white,3
"The cyst , which can be as _ as a nut or as large as a grapefruit , can be removed by surgery , allowing the baby to develop normally .",small,cyst,grapefruit,be,big,small,large,white,1
And there are other people who try to fix up something far more important with things just as _ as a can of mud .,worthless,people,can,fix,worthless,unique,valuable,selfish,0
"They could simply advertise the amount of SumoMe users it would be substantial , but it 's no where near as _ as a number in the billions .",exciting,They,number,'s,old,random,exciting,single,2
The shop should look and smell as _ as a hospital .,clean,shop,hospital,look,clean,dirty,expensive,quick,0
"I like to give up the car and occasionally take the means of transport as _ as mankind , a cart full of newly mown hay and pulled by a horse .",old,transport,mankind,means,expensive,important,old,new,2
"With our characters dead , Gary and Rob signed our "" death certificates "" on the backs of our character sheets and we all left as _ as clams !",happy,we,clams,left,blue,happy,sad,unhappy,1
"But the clubs that they are vending , Are as _ as a horn ;",hollow,clubs,horn,Are,solid,glossy,defunct,hollow,3
"Just as obviously , collusion and price - fixing are not nearly as _ as racism or rape , but all of them are equally indefensible .",evil,collusion,racism,are,exclusive,expensive,evil,competitive,2
"A one - sided argument is just as _ as a story with holes in itin fact , they 're one and the same .",bad,argument,story,is,long,bad,good,funny,1
Capitalism is as _ as civilization .,old,Capitalism,civilization,is,old,late,new,young,0
