sentence,property,topic,vehicle,event,option0,option1,option2,option3,ans_idx
"View full Institute of Art student Gloria Pridemore takes on Rodin at the Cleveland Museum of Art in a drawing exercise as _ as museums : learning from the Litt , The Plain Dealer In December , the Cleveland museum completed an eight - year , million expansion and renovation funded by what it calls the largest private capital campaign for a cultural project in Ohio history .",old,exercise,museums,drawing,new,fun,old,historic,2
"sorry I made you stutter On May 31 , 2017 at 8:52 am , Matthewsays : Since you 're about as _ as a brick , I 'll explain it to you .",dense,you,brick,'re,yellow,dense,red,solid,1
The descriptions of landscapes are as _ as loam ;,rich,descriptions,loam,are,hard,green,soft,rich,3
"As they sat thus something brushed against Peter as _ as a kiss , and stayed there , as if saying timidly , "" Can I be of any use ?",light,something,kiss,brushed,light,green,red,soft,0
"No , it was n't as _ as Apple 's juggernaut 1.6 million iPhone 3G sold in just 3 months in the US of A but that has dramatically changed over the years -- Android now runs on over a billion devices .",big,it,juggernaut,was,small,fast,little,big,3
"All of which combined to create this tart : And while it may not be as _ as a trip to Cambodia with my family , it 's definitely the kind of dessert that takes you out of your surroundings and takes you away to another place .",awesome,it,trip,be,awesome,hard,dangerous,fun,0
"she could only flounder gracelessly up to her elbows , her backbone as _ as a noodle .",limp,she,noodle,flounder,yellow,ugly,limp,delicious,2
Most people assume German cars are as _ as the sun rising and French cars - as flaky as a croissant .,reliable,people,croissant,are,unreliable,cruel,reliable,competitive,2
"We all kept as _ as mice a full half - hour , and should have done so longer , only Joseph , having finished his chapter , got up and said that he must rouse the master for prayers and bed .",mute,We,mice,kept,safe,other,mute,secret,2
Judgment after death is as _ as life ;,sure,Judgment,life,is,sure,unsure,final,real,0
"If a person accepts any sort of payment for calling a benefit auction ( "" payment "" could be as _ as a meal ) , an individual is required to have an auctioneers license .",simple,auction,meal,be,subtle,complex,simple,expensive,2
"As the late , great Muhammad Ali taught us , boxers can be as _ as dancers , moving in a choreography of aggression and pain .",graceful,boxers,dancers,be,clumsy,graceful,awkward,sexy,1
"If I could have that , along with a little AJAX support , I 'd be as _ as a lark .",happy,I,lark,be,happy,sad,interested,unhappy,0
"I 've reached it long ago , And now am nearing Eighty With hair as _ as snow .",white,I,snow,reached,beautiful,sharp,white,fresh,2
"Maybe the http protocol is not as _ as samba or the control of the player is different ( wrong display ratio , stuttering ) .",effective,protocol,samba,is,slow,fast,ineffective,effective,3
A considerable feast is set out on a platter as _ as a shield .,big,feast,shield,set,big,little,good,small,0
since his last words he had remained as _ as a tomb .,silent,he,tomb,remained,cold,empty,silent,alone,2
You are about as _ as a lump of granite,elastic,You,granite,are,cold,slippery,elastic,hard,2
Let 's say Rivera 's as _ as a whistle but who checks out Vargas,clean,Rivera,whistle,'s,dirty,sharp,clean,evil,2
Bonds can be as _ as torture if applied with enough viciousness,cruel,Bonds,torture,be,cruel,physical,miserable,painful,0
The Bishop of Greathaven was as _ as a ship heaving landward,noble,Bishop,ship,was,other,evil,noisy,noble,3
The smell of evil embrocation drifted up even as _ as the clouds of Heaven,high,smell,clouds,drifted,back,high,low,dark,1
For three years now I 've carried this pack with me from place to place a penance a mortification a burden that weighed as _ as sin thinking never again to open it never again to be asked to take out my chisel or swing my mallet,heavy,burden,sin,weighed,awful,heavy,bad,guilty,1
Yes said Gabriel though he felt as _ as the thistle she had just stood on,crushed,Gabriel,thistle,felt,awful,dangerous,dead,crushed,3
She curled up in the leather sofa that looked as _ as a bed and waved Zen into a matching armchair opposite,comfortable,sofa,bed,looked,uncomfortable,comfortable,soft,small,1
The continual passage from one to the other was initially as _ as a succession of hot and cold showers and ultimately as enervating,refreshing,passage,showers,was,safe,refreshing,hot,slippery,1
But like medicine it did him good and the food tasted better than it looked and after a while the silence grew less tense and they began to chat about the contrast between bloody - minded earnest Perugia just visible on its wind - swept ridge as a distant smudge of grey and Assisi symbol of everything nice and pretty and kind whose pink stone made even its fortifications look as _ as an illustration in a book of fairy tales,innocent,fortifications,illustration,look,innocent,guilty,quick,medieval,0
Great creatures roamed the forest some like bears others like cattle reaching up on hind legs that were as _ as oaks to chew leaves and berries from the tops of the trees,thick,legs,oaks,were,slim,strong,thin,thick,3
The tentacles went momentarily as _ as rods hurling their various cargoes around the room before bunching up protectively in front of the abused Eye,stiff,tentacles,rods,went,stiff,hard,sharp,slow,0
In one boot was thrust a riding crop unusual in that it was as _ as a spear and tipped with tiny steel barbs,long,it,spear,was,long,good,thin,low,0
as if life itself were not as _ as the house one was coming back to,empty,life,house,were,full,unfair,expensive,empty,3
It ran as _ as clockwork hard disk floppy drive monitor and printer port,smooth,It,clockwork,ran,sure,fun,smooth,rough,2
She was as _ as a cat stalking a bird,tense,She,cat,was,tense,thirsty,relaxed,lazy,0
He gathered her to him his voice low crooning as _ as honey on a wound,soothing,voice,honey,crooning,pleasant,delicious,soothing,familiar,2
Then she was crying aloud as she felt her body quickening to climax and the tears wet on her own cheeks as she soared to a summit she had never hoped to experience as beautiful and spectacular and as _ as the fireworks of Tivoli and like them over too soon leaving her both satiated yet hungry to renew the experience,free,summit,fireworks,experience,free,tall,FALSE,rocky,0
He had wooed her with hunger tempered with tenderness lifting her to heights of fulfilment she could never have even imagined before she had met him and she 'd been a willing eager vessel wreaking her woman 's power over him submitting joyfully to his possession until in the final moment of consummation she had robbed him of his strength leaving him as _ as Samson shorn of his crowning glory,helpless,him,Samson,leaving,hungry,silent,sad,helpless,3
The Havvie Blaines of this world ought to wear a sign warning decent women off and he 's as _ as the devil which does n't help,handsome,he,devil,'s,gay,evil,handsome,wicked,2
And by that maxim McAllister she 's as _ as sin and high time Master Neil realised it,ugly,she,sin,'s,attractive,ugly,pretty,beautiful,1
Her mind leapt as _ as the moon somehow she knew the seal could answer her heart 's desire but how could she make it happen,high,mind,moon,leapt,low,bright,high,blue,2
With this Glendower rampaging round Wales as _ as a bird and threatening Ruthyn every time Lord Grey turns his back,free,Glendower,bird,rampaging,green,free,fly,bound,1
She smiled a small smile as _ as rue that just curled the corners of her lips,bitter,smile,rue,smiled,bitter,sexy,warm,sweet,0
The Welsh wanted none but valuable prisoners and had no interest in killing the others since they would surely leave this place more nimbly and rapidly than the English survivors and be as _ as the stars by the time another force looked for them,inaccessible,they,stars,be,several,other,accessible,inaccessible,3
Her mouth was as _ as a bone but she resisted ignoring the can he proffered and stared resolutely up at him,dry,mouth,bone,was,hard,red,wet,dry,3
His grip was like iron bands around her wrist his face was as _ as thunder his eyes,black,face,thunder,was,red,blue,black,straight,2
In Darcy 's Utopia money will be as _ as coconuts in a country where they fall from the trees it will cease to be a corrupting cause,meaningless,money,coconuts,be,meaningful,meaningless,worthless,significant,1
A formidable West Indian nurse bellows at me as _ as the rooster himself,sure,nurse,rooster,bellows,unsure,sure,uncertain,chief,1
The images were still as _ as the rain that had fallen so dispiritedly on the mourners as they stood at one side of the grave while the rector had intoned the fateful words,clear,images,rain,were,clear,opaque,unclear,heavy,0
Kate 's face went as _ as the towel around her head,white,face,towel,went,white,warm,red,black,0
In the press in the House of Commons in reports to government departments and in popular folklore there emerged the evacuee stereotype a dirty lice - ridden and foul - mouthed urchin who wet the bed with monotonous regularity preferred fish and chips to a proper three - course meal and was about as _ as a wildcat similarly the evacuee mother appeared as a negligent slut impossible to live with and having the vocabulary of a Billingsgate fish porter,tame,urchin,wildcat,was,tame,female,wild,cunning,0
I am reliably assured that King 's College Chapel in Cambridge which has stood as _ as a rock for the past 450 years could never be built today because the design would never be accepted under the safety limits of the building regulations,steady,Chapel,rock,stood,old,smooth,hard,steady,3
Whoever painted them saw life as _ as toothpaste or pretended to,clean,life,toothpaste,saw,foul,clean,dirty,delicate,1
The house was as _ as the garden outside,silent,house,garden,was,white,public,expensive,silent,3
It is as _ as the entrance to a tomb,twisted,It,entrance,is,back,twisted,main,build,1
You think I am as _ as stone he said,cold,I,stone,am,red,smooth,hot,cold,3
Its principal hall which still stands is as long and as _ as a ship with delicately carved kiosks and balconies projecting out over the lake,narrow,hall,ship,is,wide,small,broad,narrow,3
The excitable Delhi poet Mutahhar of Kara went even further The moment I entered this blessed building he writes I saw a soul - animating courtyard as _ as the plain of the world,wide,courtyard,plain,saw,wide,narrow,big,open,0
I 've brought out a pack of cards but when you know you 've got them only to while away the hours they are as _ as a stack of washing up,exciting,they,stack,are,double,old,exciting,neat,2
If I was lying on that floor I 'd be as _ as a cat outside a birdcage,hungry,I,cat,be,sick,lazy,thirsty,hungry,3
And I listen at the wall for sounds from Jancey but it 's as _ as a pillow and she 's obviously gone to bed,quiet,it,pillow,'s,loud,noisy,vocal,quiet,3
When the corpse floated past it was as _ as a branch drifting in the water and once we had passed it it stayed bobbing in the water as if tied to our stern,ordinary,it,branch,was,local,ordinary,first,remarkable,1
The trouble was that it seemed as _ as a lion apologising to a gazelle,likely,it,lion,seemed,fun,unlikely,probable,likely,3
When she asked him if they had really been as _ as angels he had told her abruptly to look at the portraits just as now sensing that she had been hounded out of the house he had given her something to do a task to occupy her hands and head,beautiful,they,angels,been,beautiful,average,ugly,hideous,0
And then he gave orders to Punch for tea to be prepared and they had a terrible time finding any china that was n't cracked or broken and then she went on working in the pantry as _ as a mouse and she could hear you both talking as clear as clear,quiet,she,mouse,working,quiet,slow,noisy,pretty,0
She keeps their home as _ as a refrigerator and about as warm,clean,home,refrigerator,keeps,dirty,clean,safe,nice,1
Whether this was because of the weather which was warm or because they were all as _ as cats or perhaps because they were actors manqu Julia had not yet decided,curious,they,cats,were,needy,gentle,curious,cunning,2
Watch that brickwork dry off in the sun it 'll be as _ as the arch here in ten minutes,pale,it,arch,be,strong,triumphant,dark,pale,3
He was as free and as _ as a bird as he made sure to tell her and they clearly got along well,single,He,bird,was,divorced,double,single,fly,2
She would n't be here now dressed to the nines for an evening that would be about as _ as an attack of flu if she had n't again responded in anger to her emotions,thrilling,evening,attack,be,thrilling,cool,romantic,fun,0
She was as _ as a die and a pillar of the community,straight,She,die,was,crooked,straight,hot,bent,1
He was as _ as the stone she sat on she thought forlornly,cold,He,stone,was,smooth,cold,hot,hard,1
Meredith he said quietly his voice which was as _ as silk your father ordered that his possessions should be burnt,soft,voice,silk,was,soft,low,deep,fine,0
They looked as _ as maids in May,fresh,They,maids,looked,stale,fresh,ripe,rotten,1
Rachel looked as _ as a picture her lovely body warmly covered by a grey riding cloak lined with miniver fur,pretty,Rachel,picture,looked,fair,good,pretty,dirty,2
Just hanging there from one of the beams swaying as _ as a leaf in the wind,free,beams,leaf,swaying,cool,free,new,back,1
Around it some villagers were drinking their departed companion 's health and by the looks of them were almost as _ as the corpse they were mourning,absurd,villagers,corpse,were,pagan,religious,absurd,ugly,2
Richard Phillips is the Mary Shelley who created the monster and I have no doubts in saying that he is as _ as a snake and supremely gifted in his chosen field,mad,he,snake,is,drunk,mad,gay,happy,1
That was about as _ as a stick of shit in the tub - water,welcome,That,shit,was,disgust,bananas,dirty,welcome,3
It darted out in front of her as _ as quicksilver as Lisa was driving her rusty old Mini towards the exit of the sunlit hotel car park,sudden,It,quicksilver,darted,fun,sudden,bananas,disgust,1
In spite of the fact that he was as _ as a bird it was possible that he regretted what had happened,free,he,bird,was,free,bound,like,dead,0
The pleasure he felt and the calmness and the determination burned as _ as the trees in the forest,dear,determination,trees,burned,green,few,dear,dangerous,2
In the fuselage holes which are as _ as fanlights showed bright sky on the other side,big,holes,fanlights,are,big,little,hard,bright,0
My hand was as _ as a football and throbbed with a pain that extended to the shoulder blade,large,hand,football,was,long,small,rough,large,3
Benjamin turned as _ as a top his eyes sharp and questioning,quick,Benjamin,top,turned,dangerous,down,slow,quick,3
Her skin was as _ as milk her eyes were green flecked with amber and rather slanted,white,skin,milk,was,black,soft,hard,white,3
And added my own selfish after - thought that the whores in Paris were the most skilled in the world whilst cups of claret were as _ as water there,cheap,claret,water,were,hot,expensive,cheap,cold,2
He came back an hour later looking as _ as a cat who 'd stolen the cream,smug,He,cat,looking,useful,happy,smug,lazy,2
According to Theory Y however the expenditure of physical and mental effort in work is as _ as play or rest,natural,effort,play,is,free,artificial,natural,unnatural,2
But the rejoicing and the laughter which followed the tears were of equal importance because they powered the erotic joy that was as _ as the water falling from the sky,important,joy,water,was,important,insignificant,dangerous,good,0
Standing beside the water tank on top of the caravan 's portable step Pa looks as _ as a Zulu in his red stole brown for me with the black umbrella held over his head at full stretch by Ma who is standing behind in the mud and wet with a white towel draped over her arm and her hair flat and all dark with water,tall,Pa,Zulu,looks,old,short,large,tall,3
The slide - car was as _ as history yet it had one advantage the farmer could carry loads on gradients where it would be dangerous to take a wheeled cart,old,car,history,was,long,young,new,old,3
She is as _ as a chemist with her reproaches,careful,She,chemist,is,smart,beautiful,careful,careless,2
It 's as _ as hell said Lydia,hot,It,hell,'s,beautiful,cold,hot,freezing,2
I have been dead for a long time and by day I circle the huge air above the hills and by night I sleep as _ as the rock and the little worms mean consolation as they eat me,quiet,I,rock,sleep,quiet,cold,loud,noisy,0
I would remember against my will the fragrance of coffee and hot bread the energy that had possessed me so short a time ago when I had felt _ as an eel as powerful as a salmon as sure and quiet and graceful as an owl,slender,I,eel,felt,slender,late,soft,elastic,0
I felt that my life fitted me as _ as a garment designed for somebody else,ill,life,garment,fitted,finite,upper,ill,outer,2
reveals the fruit in ripeness when the floss inside is ready to be plucked as _ as the lock of hair I keep with me always from your dear golden head,soft,floss,lock,plucked,sharp,smooth,soft,hard,2
He had it then as _ as a map of a well - charted route unfolded on the captain 's table what lay in store for him and for the settlement though the islanders had not burned wet leaves and swelled white smoke into a pillar of cloud to issue a warning the signal might as well have been as clear,clear,it,map,had,clear,unclear,accurate,flat,0
The African is as _ as a ploughox each man can do the work in this clime of two or three of men like us,strong,African,ploughox,is,heavy,strong,weak,slow,1
Lately he 's been as _ as a bitch on heat,delicate,he,bitch,been,stupid,dead,happy,delicate,3
Jealousy he thought was as _ as fear the same dryness of the mouth the thudding heart the restlessness which destroyed appetite and peace,physical,Jealousy,fear,was,irrational,physical,constant,mental,1
I was given the opportunity to have a rehearsal with him but I declined because I am not like the professionals who can rehearse in detail and then put it over as _ as a daisy when the time comes,fresh,rehearsal,daisy,put,fresh,blue,stale,yellow,0
She rode along swaggering like a man till she came to where the lane turned into the field and there she called out as _ as brass now please the powers I may find a tiger in the field,bold,she,brass,called,bold,beautiful,hot,cunning,0
This trowel is every bit as _ as a knife or bayonet and will easily prize up any large stones I have done this often even in rock - hard clay,strong,trowel,knife,is,sharp,strong,weak,fragile,1
My face was as _ as a tomato as I was shown to my seat,red,face,tomato,was,green,round,red,yellow,2
The sheets seemed as _ as blankets and Flit was the only thing that prevented the mosquitoes descending on us like vultures,heavy,sheets,blankets,seemed,light,heavy,warm,cozy,1
We had no means of communication with the people in the mountains which to us were as _ as Tibet and the doctor had not ventured there again in fact he was now in great danger,remote,mountains,Tibet,were,feudal,beautiful,majestic,remote,3
In spite of all this food I remained as _ as a rake and was as hungry as ever,thin,I,rake,remained,sharp,fat,thin,thick,2
Still not worried still sliding smoothly through the crowds feeling as _ as a shadow I passed from night - spot to night - spot,elusive,I,shadow,feeling,chilling,elusive,reflective,fuzzy,1
By the middle of the century chamber cantatas were being written all over Italy the composers were as _ as the madrigalists of the previous century,numerous,composers,madrigalists,were,old,classical,talented,numerous,3
The treatment of the sky and of the areas between the various landscape objects the boats lighthouses and breakwaters in terms of the same facets or pictorial units into which the objects themselves are dissolved has the effect of making space seem as _ as material one might almost say as pictorial as the solid objects themselves,real,space,objects,seem,solid,big,real,imaginary,2
His voice had been as _ as the whisper of a breeze against silk,faint,voice,whisper,been,soft,faint,loud,low,1
He went as _ as a rake and deathly pale then for a couple of weeks,thin,He,rake,went,thin,fat,thick,sharp,0
Susan 's face was as _ as snow and she was shaking with cold,white,face,snow,was,black,white,fresh,beautiful,1
The dyed black hair was as _ as skin over his head except at the front where there was a curly fringe like the edge of a pie - crust,tight,hair,skin,was,loose,slack,tight,long,2
But more than that it was the shock a feeling that left his body as _ as ice and sent these involuntary convulsions through him,cold,body,ice,left,blue,hot,cold,cool,2
The improvisation stretched on drawing Susan into it locking into set patterns of repetition which were as _ as the gaze of a cobra,fascinating,patterns,gaze,were,fascinating,intricate,cold,beautiful,0
Nevertheless the promotion of tourism was as _ as the railway itself,old,promotion,railway,was,old,new,young,long,0
It was as _ as a glass of lager,cold,It,glass,was,empty,clean,hot,cold,3
One would be the version to be found in the published research papers those strange constrained pieces of writing whose conventions are as _ as a sonnet whose scientific account is always a set of clearly designed unambiguously conducted and conclusive observations building from earlier data and in their final paragraphs pointing the way to future experiments more research is needed to,rigid,conventions,sonnet,are,stupid,generic,flexible,rigid,3
Because to make a microscope preparation means that the tissue has to be fixed and stained what one sees always looks as if it is a very rigid structure but in the living organism the dendritic pattern of neurons is as _ as the branches of a growing tree in a gentle breeze so changed branching patterns are perhaps not so hard to envisage,mobile,pattern,branches,is,green,random,mobile,useful,2
His eyelashes were extravagantly long tar black and as _ as the teeth on a comb and his lids were gently slanted harbouring eyes of an electrifying blue,thick,eyelashes,teeth,were,slim,thick,thin,sharp,1
It was as _ as a stone worn by aeons of tides on the seashore,blank,It,stone,was,smooth,hard,opaque,blank,3
The house was as _ as death as the inside of a skull but the year was 1953 I was an atheist and an absolute non-believer in spiritualism ghosts and all that mumbo - jumbo,quiet,house,death,was,loud,sound,noisy,quiet,3
I hesitated a moment then saw her face as _ as the door behind her and gave up,blank,face,door,saw,pale,sharp,blank,hollow,2
For Christ 's sake M ' lud the matter 's as _ as the loincloth on the Crucifixion,clear,matter,loincloth,'s,unclear,cloudy,opaque,clear,3
She clung to him and his mouth found hers and she tasted as fresh and as _ as the morning and desire had exploded within him and he thought that after all he had been wrong once would never be sufficient he wanted her for always he wanted to be with her to share everything with her,new,she,morning,tasted,early,new,hot,old,1
It seemed an arid mountain as _ as a chalk down in Sussex,dry,mountain,chalk,seemed,wet,dry,yellow,sweet,1
We suddenly realized that we were as _ as air and could n't think of a thing to do with this unexpected liberty,free,we,air,were,clear,bound,open,free,3
Tess 's face went as _ as the snow on the ground,white,face,snow,went,red,white,cold,fresh,1
"It was built of boards , so that the sun made it as _ as an oven .",hot,it,oven,made,black,cold,hot,beautiful,2
""" He was as _ as a raspberry .",purple,He,raspberry,was,green,purple,red,sweet,1
"This recipe is as _ as a pair of jeans and , we suppose , could be doctored with a handful of chocolate chips or shredded coconut , but why mess with perfection ?",basic,recipe,jeans,is,basic,sloppy,traditional,messy,0
"If a business is centered around your individual talents , the need for good time management should be as _ as a slap in the face .",obvious,need,slap,be,subtle,light,important,obvious,3
"His room was as _ as pitch with the thick darkness ( for the shutters were close fastened through fear of robbers ) , and so I knew that he could not see the opening of the door , and I kept pushing it on steadily , steadily .",black,room,pitch,was,square,large,empty,black,3
"Your fun to have around , but this kid is about as _ as a marshmallow !",funny,kid,marshmallow,is,sweet,good,soft,funny,3
"It is a tale as _ as time , a wall separating gamers at their very core .",old,tale,time,is,new,old,long,young,1
Guy at Table 5 is as _ as a turd in a toilet bowl while everyone else is wondering why the restaurant just get so hot and stagnant .,happy,Guy,turd,is,unhappy,happy,sad,sexy,1
The Hollywood action hero is as _ as movies .,old,hero,movies,is,old,important,new,young,0
"When the two armies clashed the arrows flew in such clouds that they darkened the sky , the hooves of the chariot horses were like thunder upon Olympus , the brazen armour of the Atlanteans dazzled the eye and their spearheads seemed as _ as wheat growing in a field .",countless,spearheads,wheat,seemed,countless,now,rag,there,0
"For two weeks , he could get as _ as a firecracker .",hot,he,firecracker,get,hot,orange,cold,red,0
"' she said , smiling as _ as honey , and creeping close up .",sweet,she,honey,smiling,warm,sexy,beautiful,sweet,3
"This new moon will arrive with Jupiter in close alignment , which is as _ as diamonds .",rare,moon,diamonds,is,rare,precious,green,valuable,0
He was as _ as a rail .,skinny,He,rail,was,drunk,light,skinny,wooden,2
"BALDESSARI : That should be the goal for all art , to be as _ as a flashcard .",simple,art,flashcard,be,simple,subtle,complex,small,0
