sentence,property,topic,vehicle,event,option0,option1,option2,option3,ans_idx
A mother can seem both ageless and as _ as the hills to her child,old,mother,hills,seem,alive,young,old,new,2
Perceptions may change her body can feel as _ as a mountain and her own breathing be heard as an urgent sound coming from a different person,vast,body,mountain,feel,vast,whole,great,tall,0
It was indeed as _ as hell inside the aircraft,hot,It,hell,was,chilled,hot,beautiful,cold,1
It was not surprising that Benny had been as _ as a hen walking on hot coals all summer long never able to keep still always jumping up with some further excitement,excited,Benny,hen,been,drunk,hot,excited,old,2
I like being as _ as thieves with her,thick,I,thieves,being,petty,thin,thick,slim,2
To the Romanian audience for these trials which were broadcast live on television the lists of cartons of cigarettes or kilos of refrigerated meat were as _ as the tales of the riches of the Sultan in One Thousand and One Nights,fascinating,meat,tales,were,delicious,funny,red,fascinating,3
It is to be as _ as a city built upon a hill,visible,It,city,be,visible,hidden,invisible,noisy,0
Plexiglass used by many modern German artists she considers about as _ as glass can be the antithesis of good glass,dead,she,glass,considers,empty,alive,dead,broken,2
And while not everyone can detect the tonal nuances of brass and chrome jackplugs it 's as _ as the selector switch on your 62 Strat that one mag has more body more highs and more sustain than a patent - applied - for Shredbucker,plain,it,selector,'s,plain,red,still,black,0
All at once one of the birds it seemed enormous to the child but may well have been as _ as a sparrow flew into the air and fluttered past the pushchair its wings actually brushing the little girl 's face,small,birds,sparrow,been,large,light,small,beautiful,2
It 's as _ as day tonight,light,It,day,'s,big,slow,light,first,2
Great care must be exercised with these core pieces as the material is as _ as glass and easily broken by careless handling and assembly,brittle,material,glass,is,solid,new,opaque,brittle,3
Theory - crammed history of artificial and military intelligence which suggests that the cybernetic organism is as _ as the Greeks and as modern as the Tomohawk missile,ancient,organism,missile,is,modern,complex,dangerous,ancient,3
She had done sterling service already and was as _ as a ship can well be which is actually as we have already speculated not quite indifferent after all,indifferent,service,ship,was,civil,indifferent,bore,noisy,1
He is as _ as a brush and had to be persuaded ours was a worthwhile cause,stupid,He,brush,is,dead,dense,stupid,drunk,2
I can go on for another three or four years yet because I 'm still as _ as a fiddle he said,fit,I,fiddle,'m,heavy,happy,fit,dead,2
In fact she was as _ as a mouse and Ruth hardly knew she was there,quiet,she,mouse,was,loud,noisy,slow,quiet,3
After morning service when the last of the footsteps and voices exchanging greetings had died away she heard the vicar ride off the clip - clop of the horse 's hooves as _ as a bell on the cold air,clear,hooves,bell,heard,clear,red,important,bad,0
I wanted to express what a simple thing death and burial is just as _ as the falling of a leaf - just a bit of earth dug up a wooden cross,simple,death,falling,is,sudden,simple,complex,short,1
The family scene may not be as _ as silk but is it ever,smooth,scene,silk,be,sleek,soft,rough,smooth,3
I 'm as _ as a pig deep down she says,selfish,I,pig,'m,selfish,pink,sick,green,0
During our set the sky grew gradually darker and darker until by the last number the sky was as _ as the ceiling of the Camden Falcon,black,sky,ceiling,was,black,clear,sunny,blue,0
The songs are consistent in that they are uniformly as _ as an Asian skinhead as profound as a boiled egg and as lifeless as a dick in a refrigerator,confused,they,dick,are,horizontal,confused,sunny,above,1
Leo bless him was as _ as sin and James had been referred to by more than one gossip columnist as a sex symbol,ugly,him,symbol,was,attractive,ugly,beautiful,gay,1
At first it was part of a dream which vanished as _ as I woke and knew that I was alone on the broch island lying on the turf in a sleeping - bag with my head pillowed on my rolled - up sweater but seemingly connected with the earth itself from which apparently right below my head came a sound every bit as strange as the mermaids ' song of the seals,soon,dream,song,vanished,good,next,right,soon,3
Ewen went as _ as paper and jerked upright in his chair,white,Ewen,paper,went,black,thin,hard,white,3
Levy 's voice is as _ as a shag on the floor of a sandpaper factory the lyric is utterly ridiculous describing the popularity and stylishness of a certain fashionable item and the soprano sax added to that tender little guitar lick from the Arrested Development record just upsets your soul,rough,voice,shag,is,sound,smooth,foul,rough,3
It 's as _ as a cat in hot weather with the lyric amounting to a mere two verses before the vocals just sit down to let the languid groove take over,lazy,It,cat,'s,thirsty,lazy,active,productive,1
For emotional resonance flags are about as _ as a quadrilateral of cloth can be,potent,flags,quadrilateral,are,potent,vertical,periodic,patriotic,0
' E 's a spry ole thing but he 's as _ as butter ent you ole boy and he knelt down and ruffled his fur,soft,he,butter,'s,soft,sweet,hard,hot,0
One of his friends who was called John she heard during the introductions was as _ as Larry but dark as a panther cool as a wooded river,beautiful,John,river,was,deep,strong,beautiful,ugly,2
He was nearly as _ as the ceiling and hardly had to reach,tall,He,ceiling,was,low,old,gay,tall,3
She felt as _ as the smell of beer in the air as crude as the wood of the tables as cheap as the picture mirrors on the walls,heavy,smell,mirrors,felt,soft,light,sweet,heavy,3
The cause was a common one and as _ as the hills but I was unable to talk about it for years,old,cause,hills,was,old,tall,new,young,0
Perdita went as _ as the guides ' unconsumed lemon squash,green,Perdita,squash,went,red,blue,green,yellow,2
Martin Fierro 's aim in life was to sleep on a bed of clover look up at the stars and live as _ as a bird in the sky,free,aim,bird,live,free,dead,sharp,fly,0
Do n't call me that you great jerk said Perdita hammering her fists against his chest which was as _ as the ground outside,hard,chest,ground,was,soft,hard,flat,solid,1
To give Perdita confidence in her first chukka he 'd put her on a dark brown pony called Chimango which meant bird of prey who was as _ as a rock but who swept down on the ball like a hawk,steady,bird,rock,was,smooth,heavy,steady,hard,2
However despite suffering a minor heart attack 15 years ago Len from Fressingfield Suffolk said he felt as _ as a fiddle and intended to make next year 's drop,fit,he,fiddle,felt,fit,small,large,heavy,0
And though we give you a finish that 's as _ as nails everything is made to a remarkably gentle formulation,hard,finish,nails,'s,hard,sharp,soft,easy,0
She was as _ as gold not making a sound all the way to the dog 's home,good,She,gold,was,pure,good,pretty,beautiful,1
She is as _ as a lamb and while most people are cautious when meeting her they soon think she 's wonderful,gentle,She,lamb,is,rude,gentle,rough,mean,1
Looking at him as he stared into the night she felt a surge of affection as pure and as _ as the flow of cold air against her face,elementary,affection,flow,felt,elementary,then,catching,upstream,0
I 've only been in your bed with you once and then you were as _ as a cat thinking that sister of yours might come back unexpectedly,rough,you,cat,were,wild,rough,large,smooth,1
And the Guinea Coast afore that she prompted hoping for tales about unknown Africa that seemed to her as _ as the moon and as far away,strange,tales,moon,seemed,important,funny,radiant,strange,3
He could feel reserve even hostility coming towards him as _ as the smell of roasting meat,real,hostility,smell,coming,real,imaginary,fake,good,0
The train of thought that begins like this is as _ as an eel and the only effective way to catch it is to examine the truth of the matter,slippery,train,eel,is,sticky,slippery,cold,ugly,1
And Jean - Paul can be as _ as a mule and you knew perfectly well that if you 'd told him what you felt he would have dug in his heels and insisted,stubborn,Paul,mule,be,stubborn,dense,poor,drunk,0
Achieving a maths mark in double figures all tests are marked out of 50 was about as _ as Iceland winning the Eurovision song contest or Michael Jackson growing up to be normal or growing up at all come to that,likely,Achieving,Iceland,was,probable,likely,common,unlikely,1
It 's just as _ as pads or cotton wool balls and is thick extra-absorbent for mopping up jobs and it wo n't fray either,soft,It,pads,'s,hard,soft,flexible,flat,1
When Mr Wormwood arrived back from the garage that evening his face was as _ as a thunder - cloud and somebody was clearly for the high - jump pretty soon,dark,face,cloud,was,light,dark,transparent,pale,1
She saw the child white in the face which is as _ as paper trembling all over the eyes glazed staring straight ahead and seeing nothing,white,face,paper,is,coloured,white,red,black,1
Although the music they are dealing with is as _ as the hills they have still managed to inject a little of their own venom into what was once regarded as a mummified corpse,old,music,hills,is,young,new,tall,old,3
Plus they rely far too heavily on Chad Gracey 's bionic drumming to get them noticed the tinny snare effect soon becoming as _ as a catfight underneath your window at 3.00 am,annoying,effect,catfight,becoming,dangerous,fun,violent,annoying,3
It was as _ as a bone under a never - ending roaring waterfall,dry,It,bone,was,hard,chill,wet,dry,3
And high above at the end of the curve the steep hillsides rose as _ as the rim of the dormant volcano on High Island,high,hillsides,rim,rose,high,strong,sweet,hard,0
After all I felt as _ as a fiddle he explained,fit,I,fiddle,felt,flexible,broken,fit,rigid,2
We arrived as _ as a couple of puppies out for their first walkies full of fun and raring to go,keen,We,couple,arrived,back,keen,happy,alone,1
They were close to starvation and typical of barn owls when they 're frightened they sat as _ as dummies not making a sound,stiff,they,dummies,sat,old,dead,stiff,heavy,2
Mogadishu once known as the pearl of the Indian Ocean with its whitewashed buildings leafy streets and pretty pavement cafes is now more bullet - battered than Beirut and about as _ as a saunter through an Iraqi minefield,safe,cafes,saunter,is,harmful,unsafe,safe,selective,2
It was as _ as the nose on his face,plain,It,nose,was,pointed,broken,plain,exotic,2
Brett weighed a mere 1 lb 5oz and was as _ as a watchstrap when he was born seventeen weeks early,short,Brett,watchstrap,was,tall,short,long,young,1
The house is as _ as a dodo said an insider yesterday,dead,house,dodo,is,big,live,alive,dead,3
She could sense the rising tension in the room almost as _ as the scent of all the flowers,oppressive,tension,scent,sense,dangerous,oppressive,uncomfortable,sweet,1
Besides none of us ever knew the whole story even though it was as _ as a pikestaff when you came to think about it,plain,it,pikestaff,was,fancy,decorative,plain,heavy,2
He was a strong healthy lad and as _ as punch to be working with Dad,pleased,He,punch,was,mighty,pleased,dangerous,dead,1
Both are as _ as money in the bank,good,Both,money,are,enough,good,little,bad,1
Thin and tiny in stature her back was as _ as an arrow but her legs often pained her in the cooler winter and spring weather,straight,back,arrow,was,crooked,pointed,sharp,straight,3
No anaesthetic and you 'll feel as _ as rain afterwards,right,you,rain,feel,soft,right,light,wrong,1
The Greeks preferred to find their gospel example of the contemplative life in the story of the Transfiguration of Jesus on Mount Tabor when his glory shone through his humanity and his garments became as _ as snow to the astonishment and joy of three of his disciples who were privileged to see the vision,white,garments,snow,became,beautiful,cold,fresh,white,3
The evening sun glowed from the west as _ as a dinner - gong throwing long purple shadows across the untidy lawn and into the bushes,cheap,sun,dinner,glowed,back,fun,literal,cheap,3
Do n't know what it 's like inside but it 's as _ as the ace of spades outside,black,it,ace,'s,stupid,white,black,cool,2
Nigel muttered You 're as _ as a bat as he went out,blind,You,bat,'re,blind,fly,black,brown,0
He sat back as _ as a cat that has licked the cream while Eleanor held his hand and looked concerned,smug,He,cat,sat,happy,lazy,smug,hungry,2
They laughed swam in the Humber which strangely was as _ as bathwater and a dazzling transparent blue chased each other in slow motion through the sand dunes caught each other and kissed fed each other with Marie could not decide what they should feed each other with,warm,Humber,bathwater,was,cool,cold,hot,warm,3
As I turned this thought over in my mind it became as sparkling and as _ as the morning itself,beautiful,it,morning,became,beautiful,pleasant,important,ugly,0
I saw a hole in one of his socks at the back as _ as a potato and offered to do some mending for him,big,hole,potato,saw,small,deep,big,good,2
It was a very cold frosty night in December and because the snow on the footpath was hard and uneven and as _ as ice I walked along the edge of the road,slippery,snow,ice,was,sticky,slippery,solid,heavy,1
We can hardly tell the Finance and Executive Committee that the British are unreliable at the vehicle plants but as _ as the Rock of Gibraltar when it comes to components,solid,British,Rock,but,hollow,solid,smooth,liquid,1
He went down the airless corridor to his Boss 's office said hello to the secretary and walked into the large oak - panelled room which was as _ as the lobby of many a sizeable hotel,big,room,lobby,was,big,open,noisy,square,0
They carted him like a scarecrow his heels scoring the gravel but he was as _ as a pig in a cart he would never squeal without a hard prod Donald Stewart the blacksmith had to grip his wrist to make him sign the paper,stubborn,he,pig,was,fat,cunning,stubborn,old,2
I saw their uncircumcised members as _ as day and shuddered,clear,members,day,saw,light,clear,sharp,bright,1
During the meeting with him a few months before his death which was recorded in an article published in the London Review Philip Roth found him as _ as mustard here was someone who listened with the intent stillness of a chipmunk,keen,him,mustard,found,like,gay,happy,keen,3
The answer is as _ as the sign on a streetcar it is a business man,obvious,answer,sign,is,subtle,obvious,red,simple,1
Stuck in the middle of the Oxfordshire countryside with hundreds of noisy incomprehensible children and colleagues who make me feel about as _ as a walk in the rain,comfortable,me,walk,feel,happy,uncomfortable,fun,comfortable,3
No matter that their French or German accents were as _ as a slice of sushi,thick,accents,slice,sushi,thick,sparse,thin,sharp,0
He looks about as _ as an anaconda with belly - ache from too much goat - swallowing,friendly,He,anaconda,looks,friendly,gay,happy,hostile,0
Before that can happen there has to be peace in Afghanistan and that prospect looks as _ as the end to the drug traffic,remote,prospect,end,looks,probable,funny,remote,chilling,2
Although your husband 's penis does n't have a bone in it at least not unless he 's a badger or something it does become almost as _ as a bone when he 's excited,stiff,it,bone,become,broken,stiff,flexible,hard,1
Her face became as _ as an icon as if she had momentarily glimpsed the old customs of Irkutsk a bridal party bearing skates of bone and bodices of the finest needle - point standing on the southern shore and looking across Baikal a sallow - faced groom from Chita smoothing his first moustache and pacing the deck of an ice - locked paddle - steamer,bright,face,icon,became,white,red,pale,bright,3
His mind was as _ as the ice forming on the windscreen,cold,mind,ice,was,hard,cool,cold,hot,2
The rest of us were as _ as ITV at last season 's denouement between the two clubs,thrilled,us,ITV,were,back,many,ahead,thrilled,3
In our North London fastness we are as _ as snowflakes of such matters,ignorant,we,snowflakes,are,white,ignorant,beautiful,delicate,1
Lochs which were once as _ as crystal are now coloured muddy brown,clear,Lochs,crystal,were,pure,clear,opaque,blue,1
Peter was as _ as a rock keeping the ball on the fairway and hitting nearly every green in regulation,steady,Peter,rock,was,cold,smooth,steady,clear,2
We played with Gary player for the first two rounds and he was as _ as sin about our luck with the weather because we caught it again for the second round,miserable,he,sin,was,happy,miserable,evil,drunk,1
Agnes watched her walk to the gate as _ as a sparrow and none the worse it seemed for her tumble,agile,walk,sparrow,watched,agile,stupid,fun,useful,0
Below the triumphant spires of dock which covered the beds submerged cabbages as _ as footballs could be discerned,large,beds,footballs,submerged,many,small,strange,large,3
The pre-season dispute over which contest the Eddie Aikau or the Triple Crown would have priority if the surf topped twenty feet at Waimea seemed about as _ as an argument over how many angels you could fit on a pinhead,relevant,dispute,argument,seemed,relevant,irrelevant,ongoing,important,0
Characteristically after this burst of bitter humour he added that it was quite nice even though he found his host about as _ as a mule and as human as a boa - constrictor,intelligent,host,mule,found,stubborn,dense,intelligent,stupid,2
If this flow could be transported to North Wales it would stand half as _ as Snowdon if it could be transported to Surrey it would be half as _ again as the highest hill and such is the attraction of all high objects from mountains to the cost of living it would be an important landmark regularly thronged in summer with picnickers and ramblers and would feature on scores of postcards,high,it,hill,stand,high,low,large,steep,0
It was as _ as a settee but it was dead quiet,big,It,settee,was,small,big,little,long,1
Firelight was now as _ as a lamb and would lie down and sleep beside him instead of pacing round her box all night,gentle,Firelight,lamb,was,harsh,rough,gentle,hard,2
She 's as _ as the heather in the dell,sweet,She,heather,'s,sour,pretty,sweet,bitter,2
She 's as _ as the heather the bonnie bloomin ' heather,sweet,She,heather,'s,bitter,hot,sweet,pretty,2
A horse and a cart that stands as _ as a house and cost the best part of thirty pounds and you lost them both,high,cart,house,stands,low,heavy,high,old,2
It 's as _ as a war wi ' you two Thomasina had said,bad,It,wi,'s,benevolent,good,bad,stupid,2
A virus is as _ as a bullet or a shell,neutral,virus,bullet,is,first,last,stray,neutral,3
Added to this was an acceptance of liberal Victorian culture to such a degree that it was assumed to be as _ as the gospel itself,eternal,it,gospel,be,eternal,bad,FALSE,TRUE,0
Now the sky grew nearly as _ as night and I galloped into the hotel just as the most torrential downpour I have seen in my life cascaded from the sky as the waters of the Red Sea might have descended on Pharaoh,black,sky,night,grew,black,dark,clear,blue,0
There are places roped with cablecoil guts as thick as a man as _ as a whisker a rumbling kingdom,fine,guts,whisker,roped,hard,fine,sharp,coarse,1
I was as helpless and as _ as the pig on the bench at the top of our garden nearly thirty years ago,degraded,I,pig,was,hairy,degraded,coarse,away,1
This room is as _ as a cabin in the frozen woods but it is not so _ as the heart of the person to whom I gave my love my hope my talent,cold,room,cabin,is,empty,hot,cold,dark,2
And then I want my shaft to be as _ as a furlong and time to stand still and my tongue to be dipped in honey,long,shaft,furlong,be,great,long,old,small,1
But now it seemed as _ as the confluence of two rivers and needed no words at all,natural,it,confluence,seemed,artificial,unnatural,supernatural,natural,3
He had been a cheerful fellow in those days and life was as _ as a laugh on the wind or the carelessly squandered words of a song,trivial,life,laugh,was,personal,complex,trivial,delicate,2
The sound was as _ as the closing of a coffin lid,final,sound,closing,was,final,initial,difficult,hear,0
He went as _ as a sheet and backed off immediately,white,He,sheet,went,soft,black,white,blue,2
He appeared to have a hard grasp on politics current states ' rights issues and federal judgeships being contested a scenario that had seemed as _ as the fusillade of laser fire Ali said Muslim spaceships would one day loose on the white devils,likely,scenario,fusillade,seemed,ferocious,unlikely,probable,likely,3
His speed at getting into position is breath - taking almost as _ as the power with which he murders the ball,unbelievable,speed,power,taking,fun,bad,fast,unbelievable,3
Her information came from a huge list which was as _ as a book published free by the Department of the Environment which gave details of old and interesting properties including lighthouses watch towers and windmills throughout England,thick,list,book,was,thin,thick,sparse,heavy,1
The atmosphere here 's as _ as mud she said,thick,atmosphere,mud,'s,soft,sticky,thin,thick,3
Said he was as _ as a ramrod and would get nowhere but he 's pretty hard on people anyway,stiff,he,ramrod,was,ugly,straight,stiff,sharp,2
Trollope nearly loses control on the subject of The Plumber a man doubtless aware that he is odious to be put down with the tax - gatherer as being as _ as fate and as inexorable,certain,he,inexorable,being,bad,brutal,certain,uncertain,2
Her writing is as _ as sculpture and as steady and unobtrusive as breathing,whole,writing,sculpture,is,partial,public,whole,there,2
On the other hand I 've been as _ as a turkey in January and all because of a story I spotted in a medical magazine stating that regular lashings of oily fish cut sharply your chances of having a heart attack,happy,I,turkey,been,sad,happy,unhappy,thirsty,1
Both had superb doubly dissected leaves which were as _ as the foliage of ferns hanging down for 2ft or so,elegant,leaves,foliage,were,elegant,green,clumsy,purple,0
It was as _ as the island itself if not bigger and the rocks below seemed to be wobbling under the strain of holding it up,big,It,island,was,small,little,beautiful,big,3
If the water is frozen and shifts as a glacier then it can carry entire boulders which are as _ as a hotel hundreds of miles and gouge great scars,big,boulders,hotel,are,hard,small,big,little,2
Full of fire at the first performance he would be worn out and as _ as marble at the third,cold,he,marble,be,cold,hot,dead,black,0
This Marx pointed out was as _ as a belief in fairies,idle,This,belief,was,own,green,idle,red,2
I do not know whether we dragons loved her or hated her her will was like iron as fast clad as our scaled hides but her heart was like a songbird in the morning and she was as _ as the lilies of the field,lovely,she,lilies,was,green,cunning,ugly,lovely,3
No matter how carefully he sliced each shovelful in an arc out on the wind there were certain unpredictable gusts that lifted the grains and blew them back towards the tractor so that by evening his clothes were filthy with lime his face and hands which are as _ as chalk accentuating the inflamed red round his eyes,white,hands,chalk,are,red,yellow,hard,white,3
For the unwary it is a feeling which is as _ as embarrassment or flirtatiousness,infectious,feeling,embarrassment,is,infectious,fuzzy,guilty,obvious,0
Montgomery a very outdated figure at the time of his death in 1976 had been Britain 's last military hero and he seemed as _ as Wellington or Marlborough,remote,he,Wellington,seemed,fun,remote,probable,attached,1
Compared with the mysteries surrounding the deaths of President Kennedy or Marilyn Monroe the controversy surrounding Spandau 's 93 - year - old inmate is about as _ as the fall of a dead leaf,interesting,controversy,fall,is,interesting,boring,chilling,fun,0
I 'm as _ as a daisy he declared brightly,fresh,I,daisy,'m,ripe,fresh,stale,green,1
I am always in my very best spirits for my heart has been as _ as a feather ever since I got away from all that humbug and what is more I have become fatter,light,heart,feather,been,green,light,blue,quick,1
The glittering courtiers were as _ as the bodies of the soldiers in their bright Second Empire uniforms who lay in the fields of Eastern France,scattered,courtiers,bodies,were,ripe,scattered,spoiled,rotten,1
It 's as _ as a dodo she said referring to the sheep,dead,It,dodo,'s,wild,extinct,alive,dead,3
We 're as _ as thieves the pair of us,thick,We,thieves,'re,slim,petty,thick,thin,2
Both powers in practice are as _ as a parachute in a space ship reassuring but not very practical,useful,powers,parachute,are,powerful,dangerous,useful,useless,2
If we were as _ as chickens we could utilise ambient temperature technology,smart,we,chickens,were,stupid,smart,skinny,few,1
The canyons of ruins the heaps of pancaked houses formed a front line as _ as the valleys and mountains to the east of the city,static,line,valleys,formed,ignorant,static,cunning,stupid,1
Heaps of faded yellowing newspaper cuttings their arguments as _ as the foundations of the front - line ruins are there to prove our lack of comprehension,flawed,arguments,foundations,cuttings,stupid,flawed,backward,intelligent,1
A son of the manse he lends to Labour the dark Church of Scotland tones that can make the recession sound as _ as the wind that whips off the Firth of Forth in midwinter,bleak,sound,wind,make,cool,faint,destructive,bleak,3
