sentence,property,topic,vehicle,event,option0,option1,option2,option3,ans_idx
"I am disposed to be as _ as a queen , and you try to stir me up to restlessness !",content,I,queen,be,legal,sparse,fine,content,3
"numerous icebergs , some of which are as _ as cathedrals , and occasionally loaded with "" no inconsiderable blocks of rock , "" would be stranded on the outlying islets ;",tall,icebergs,cathedrals,are,tall,expensive,short,ugly,0
"BOULT The nobleman would have dealt with her like a nobleman , and she sent him away as _ as a snowball ;",cold,she,snowball,sent,bright,cold,ugly,hot,1
"The understanding is as _ as life itself , that when women become part of a close group of men , authenticity drops to near zero .",old,understanding,life,is,common,new,old,young,2
Ahead was a stepped altar which is as _ as a cottage and dotted with blue lights .,large,altar,cottage,is,small,black,large,high,2
) This aspect is as _ as diamonds .,rare,aspect,diamonds,is,green,rare,black,translucent,1
Usually this means the off peak rate is n't quite as _ as economy 7 and there is usually a higher standing charge .,good,rate,economy,is,good,important,bad,average,0
"Recognizing a soulmate can be as _ as a moment in the sunshine , or a meeting of eyes over a cup of coffee .",sudden,Recognizing,moment,be,later,gradual,sudden,precious,2
Intent is as _ as air to those who breath no need to speak of it or even be too conscious of it : in the realm of nature and the things that are as they are but never to be taken for granted .,obvious,Intent,air,is,obvious,clear,invisible,open,0
"As long as you can drive away from their shop without toppling over or crashing into something or someone , you 're as _ as a bird .",free,you,bird,'re,like,free,early,fly,1
The Fraud Triangle Fraud is as _ as a virus and can be just as menacing .,common,Fraud,virus,is,common,popular,personal,rare,0
 And he was as _ as a whip .	,smart,he,whip,was,sharp,smart,gay,stupid,1
"He left me soothed , yet full of solicitude , breathing a wish , as _ as a prayer , that if I were wrong , Heaven would lead me right .",strong,me,prayer,left,hungry,quick,weak,strong,3
"I looked out over the beautiful expanse , bathed in soft yellow moonlight till it was almost as _ as day .",light,expanse,day,was,green,silent,light,red,2
"Many eclipses are jarring , but not this one this one is as _ as a cupcake with vanilla icing , so it may be that your friend will do something for you that you find touching .",sweet,one,cupcake,is,bitter,delicious,dry,sweet,3
And he s gone to bed as _ as a baby .,pleased,he,baby,s,cunning,pleased,innocent,messy,1
We 've been with ClickTime since 2011 and we 're still as _ as day one .,pleased,we,day,'re,bright,pleased,nice,present,1
I feel about as _ as a fish for shitting in the sea .,guilty,I,fish,feel,sorry,guilty,bad,innocent,1
"How many of you guys would say no to dating a girl who is as _ as a cow , always silent ( apart from occassional sexy moos ) , and can make Pamela Anderson feel sorry with her udders ?",healthy,girl,cow,is,holy,silly,cunning,healthy,3
it is as _ as thet .,empty,it,thet,is,empty,blue,fill,full,0
"No , the room was not cold at all , but my heartoh , dismaymy heart was as _ as ice .",cold,heart,ice,was,hot,cool,warm,cold,3
"Irregular Choice is as _ as a child in a sweetie shop to announce our first Irregular Choice Kids collection will be launching this Friday at 12 pm ( UK Time ) Our fans have been asking owner and Designer Dan Sullivan to create a children 's ' collection for years and he has worked hard to make their dreams come true , developing this capsule kid In preparation for us launching our SWAN HEELS at midday tomorrow we are giving lucky fans the chance to WIN their very own Swan Planters filled with Irregular Choice flowers !",excited,Choice,child,is,excited,curious,small,fun,0
"Irregular Choice is as _ as a child in a sweetie shop to announce our first Irregular Choice Kids collection will be launching this Friday at 12 pm ( UK Time ) Our fans have been asking owner and Designer Dan Sullivan to create a children 's ' collection for years and he has worked hard to make their dreams come true , developing this capsule kid Be carried along on a platform wave into the realm of mythical creatures where you will be mesmerised by our Irregular mermaid .",excited,Choice,child,is,playful,fun,curious,excited,3
As I got closer to finally see what was in store for me Dan said my eyes were as _ as saucers and my jaw dropped .,big,eyes,saucers,were,big,open,empty,little,0
"A car can become as _ as an oven very quickly , even when it does n't feel that warm .",hot,car,oven,become,expensive,red,hot,cold,2
Oil boilers are just as _ as gas and in some cases even more so .,efficient,boilers,gas,are,liquid,natural,efficient,hot,2
"I am as _ as a feather , I am as happy as an angel , I am as merry as a school - boy .",light,I,feather,am,nice,light,sad,green,1
"Why , she was as _ as a squirrel ;",fresh,she,squirrel,was,fresh,ripe,rotten,stale,0
They seem as _ as photographs of nineteenth - century Paris .,ancient,They,photographs,seem,modern,ancient,inaccurate,expensive,1
"Travel journals were as _ as theatergoing , and stories from the new world abounded .",popular,journals,theatergoing,were,popular,chief,unpopular,expensive,0
The Right Width Tie width is as _ as fashion itself .,periodic,width,fashion,is,fun,important,periodic,extravagant,2
"Best of all , Stott 's text is as _ as Harlequin 's moves , his eye for humour and the need to clarify details for those unschooled in that period always as deft and sure .",light,text,moves,is,good,light,extravagant,fun,1
"car can be as _ as home itself : the safety belts , the side protection wings to delicately support the baby ?",comfortable,car,home,be,comfortable,new,heavy,uncomfortable,0
Olenna matriarch of House Tyrell is as _ as a cockroach .,adaptive,matriarch,cockroach,is,female,unpleasant,dangerous,adaptive,3
"The irony of my plastic works is that I take a material that was created to be touched , and I make it as _ as an artwork .",inaccessible,it,artwork,make,important,inaccessible,fun,sure,1
Their case turned out to be as _ as smoke .,solid,case,smoke,be,heavy,liquid,solid,hollow,2
Few things can be as _ as a breakdown in that chain of mechanics and electronics .,frustrating,things,breakdown,be,frustrating,ambiguous,fun,trying,0
"here 's a solution - buy a PC , but wait until later this year when they release Vista which will look as _ as a Mac , along with all the more functional improvements .",pretty,Vista,Mac,look,compatible,bad,funny,pretty,3
"It is about as _ as a jackhammer , although even so the message did n't seem to sink in .",subtle,It,jackhammer,is,subtle,hard,heavy,simple,0
"The - messengers - oflove - should be as _ as thoughts , - traveling - ten times faster than sunbeams , pushing all doubts and fears away , as light does to threatening shadows .",light,oflove,thoughts,be,hard,simple,light,heavy,2
"Then your light will shine out from the darkness , and the darkness around you shall be as _ as day .",bright,darkness,day,be,bright,dark,dull,black,0
On 21.12 the Progress - M37 was still as _ as a fiddle which could be derived from the strong signals during the pass in the 20th orbit with a TCA at 132432 UTC .,fit,M37,fiddle,was,back,first,fit,scary,2
The water now was as _ as a sheet of glass and reflected in it was a magnificent magenta sunset - it was a perfect ending .,calm,water,glass,was,clean,calm,fragile,sharp,1
"By now , your thornapple must be as _ as blood and as fragrant as roses .",red,thornapple,roses,be,yellow,green,red,black,2
"Director Matt Spicer 's Sundance breakout is a tale as _ as time , modeled almost to a T on The Talented Mr. Ripley ( without the murder ) .",old,tale,time,is,old,young,long,new,0
"These are basic ingredients , perhaps "" but the truth about them is as _ as humanity itself .",diverse,truth,humanity,is,diverse,selfish,stupid,common,0
GED Reasoning Through Language Arts : Literary Elements Have you ever been as _ as a bull when you 're trying to study and nothing seems to work ?,angry,you,bull,been,large,dangerous,strong,angry,3
"Gage might look and act like a bronco in his den , hates to go back but set him free in a pen and he will be as _ as a lamb and as sweet as a dove .",calm,he,lamb,be,gentle,happy,calm,drunk,2
"Great herds of tame cattle grazed the pastures , the water in the streams was as _ as crystal and as fragrant as clover , while the hillsides shone with veins of white , black , and red marble and with deposits of every kind of precious metal .",clear,water,crystal,was,fresh,clear,deep,pure,1
You will be amazed to see your grapes will be as _ as sugar .,sweet,grapes,sugar,be,bitter,green,sweet,sour,2
He 's as _ as gall at your desertion and its consequences : do n't expect thanks for this noble devotion .,bitter,He,gall,'s,black,sweet,sharp,bitter,3
The bulls - eye is near as _ as a chipmunk and do n't move .,big,eye,chipmunk,is,small,big,good,little,1
""" But despite all the backstage drama , the show still churned out sketches that made us laugh hard and others that were as _ as grandma 's Christmas fruitcake .",sweet,others,fruitcake,were,bad,good,sincere,sweet,3
"Look at me , I 'm as _ as an ox .",healthy,I,ox,'m,healthy,dead,wild,sick,0
"Even if you had a Patriot battery deployed on your lawn , you would be as _ as a kitten with polio .",helpless,you,kitten,be,skinny,weak,helpless,cunning,2
"better than a good many , for I am as _ as a lion , and all men a n't ;",strong,I,lion,am,weak,strong,hungry,white,1
"and , for the space of half a year , the gunpowder lay as _ as sand , because no fire came near to explode it .",harmless,gunpowder,sand,lay,comfortable,illegal,harmless,harmful,2
One thing stood out after that day of feeding countless rounds through those UZIs - they were as _ as a brick .,reliable,they,brick,were,hard,reliable,solid,unreliable,1
""" Though your sins be as scarlet they shall be as _ as snow .",white,they,snow,be,beautiful,cold,white,fresh,2
"I 've baked it at the stated temperature and for the stated amount of time , but every single loaf is as _ as a football and about as appetizing .",tough,loaf,football,is,competitive,solid,rough,tough,3
"As I am as _ as a giraffe , the hump makes longer trips uncomfortable .",tall,I,giraffe,am,short,hungry,old,tall,3
"Woven using 25,000 flexible stainless - steel threads that are three times thinner than a piece of paper , as _ as silk and the strength that surpasses leather .",smooth,threads,silk,are,soft,rough,sleek,smooth,3
"First , the Redeemer 's saving concern is as _ as humanity .",wide,concern,humanity,is,thin,deep,wide,narrow,2
"THAT is just as _ as a rock , firm set in the depths of a restless sea .",fixed,THAT,rock,is,curious,fixed,selfish,stupid,1
"However , recently black has become as _ as denim , so I wanted to find tomorrow 's black .",customary,black,denim,become,customary,later,reflective,aware,0
"English is an eccentric language , and its students might even think were all as _ as hatters .",mad,English,hatters,were,mad,rude,happy,slow,0
"They are - about as _ as Emerald , but you will only find those Ores in their specific Biomes : Ruby : Forest like areas and Plains .",rare,They,Emerald,are,important,funny,beautiful,rare,3
They 're as _ as cornbread .,common,They,cornbread,'re,rare,uncommon,personal,common,3
"After Yo resolved her conflict with Kim by being as _ as ice dressed up in fire red ( Revlon , are you listening ?",cold,Yo,ice,being,cold,blue,cool,hot,0
"The "" to grease or not to grease square taper "" debate is probably as _ as time itself .",old,debate,time,is,old,new,long,young,0
"When the frame is finally finished , it hardens and becomes as _ as steel , provides the comfort of titanium , the stiffness of aluminum and has a fatigue life 100 's of times greater than aluminum alloys .",strong,frame,steel,becomes,strong,heavy,rigid,small,0
"But when Grandma spread out the chicken and sandwiches and cookies and lemonade in the shade of the big tree , they found that they were as _ as bears .",hungry,they,bears,were,cold,thirsty,hungry,dangerous,2
The unit is as _ as hell and easily weighs almost double the iPad 2 .,heavy,unit,hell,is,beautiful,complex,light,heavy,3
The ultimate treat for anyone that 's as _ as chocolate - but this is a treat with a difference .,sweet,that,chocolate,'s,sweet,hot,bitter,warm,0
Those are as _ as fate ;,fixed,Those,fate,are,warm,dry,fixed,sour,2
""" You are as _ as a lath and as brown as a nut .",thin,You,nut,are,thin,fat,tough,thick,0
what will seem as _ as a thatcher or fletcher does today ?,archaic,what,thatcher,seem,archaic,dead,tall,precise,0
It is as _ as a Fart in the White House .,sad,It,Fart,is,sad,glad,cheerful,happy,0
""" Her thin calico dress was soaked with the damp in the air , and she was shivering and looked as _ as a sheet .",white,she,sheet,looked,soft,pretty,blue,white,3
"She was rather thin , but young , and fresh - complexioned , and her eyes sparkled as _ as diamonds .",bright,eyes,diamonds,sparkled,wide,clear,bright,pretty,2
"The boat received major dents and scratches , it seems as the material is as _ as butter .",soft,material,butter,is,hot,soft,solid,hard,1
"I need not expatiate on the usefulness of that valuable species of cattle , which might have been as _ as asses before now , if our lawgivers had been as mindful of their duty in the suppression of jockey - ship , as they have been in the suppression of usury .",cheap,species,asses,been,dirty,cheap,ugly,expensive,1
""" "" He 's still as _ as an ox , "" Barbara interjected .",strong,He,ox,'s,slow,fast,strong,weak,2
That 's as _ as an excuse as they come .,fake,That,excuse,'s,fake,important,heavy,bad,0
"That stuff never smells or wrinkles , and is just as _ as cotton .",soft,stuff,cotton,is,thin,heavy,soft,hard,2
The curtain rose to the usual restless flutter of the audience the last coughs audiences were as _ as the performers in their reactions and the chorus began their opening song,predictable,audiences,performers,were,predictable,fun,bore,unpredictable,0
I think so far we ve been as _ as gold and can only maybe have offended Scum supporters which can only be good,good,we,gold,been,nice,bad,good,evil,2
She could feel the moment when he decided to thrust her away from him abruptly stepping back the shock of their coming apart striking as _ as a blow stunning her so that she fell back against the parapet her lips swollen by the passion of his taking a soft anguished breath escaping from between them,swift,moment,blow,striking,swift,quick,powerful,final,0
When our eyes met he went on with his mouth scarcely leaving hers it was as _ as a sword through a chink in a suit of armour,piercing,it,sword,was,piercing,painful,explosive,dangerous,0
And after being out in the sunshine with the children most of the day she 'd lost her pale city complexion becoming as _ as a berry and looking much younger,brown,she,berry,becoming,brown,red,green,yellow,0
Yet as she watched him perched as _ as a cat on the prow leaning back out over the waves to balance the little craft his splendid chest scattered with little beads of water Ronni was aware that she did n't really mean it,slender,him,cat,perched,hungry,cunning,lazy,slender,3
At last she reached a wall waist - high stone - built below which stretched the shore as _ as a seashell in the moonlight,pale,shore,seashell,stretched,blue,dark,smooth,pale,3
Well you are still as _ as a reed coltish I believe your father used to say you still have the same intriguing green eyes and those slanting eyebrows,slim,you,reed,are,hollow,high,slim,hard,2
I 'll be as _ as rain again soon,right,I,rain,be,late,left,wrong,right,3
She pushed back her hair as _ as copper in the sunshine that slanted through the big bay window,bright,hair,copper,pushed,dark,silver,bright,red,2
With a brief mocking smile he turned away and hurried up the steps to the hotel lobby his back was as _ as a roll of barbed wire,hostile,back,wire,was,friendly,hostile,lightweight,dangerous,1
The rush - hour traffic in the city centre had been as _ as a plate of home - made porridge,thick,traffic,plate,been,thick,heavy,thin,light,0
Atlantic Richfield Co. says that its new petrol is as _ as methanol and that it would be ready to start selling it in California by 1996,clean,petrol,methanol,is,blue,dirty,clean,hot,2
Remember of course that Labour and the Unions are as _ as thieves so the gr Labour Group just like its parliamentary counterpart is incapable of making a single decision without the Union pulling the strings,thick,Unions,thieves,are,stable,thin,thick,slim,2
You 're as _ as a sheet he returned implacably,white,You,sheet,'re,white,blue,smooth,soft,0
Her voice was as _ as a rock and she met his silvery - green eyes without flinching,steady,voice,rock,was,smooth,steady,hard,heavy,1
Francesca was as _ as a picture and apparently glowing with health,pretty,Francesca,picture,was,flat,pretty,white,soft,1
Her hands had been as _ as a rock until David mentioned Donna 's birth and Juliet 's on the same day and Thorn House,steady,hands,rock,been,clear,steady,free,smooth,1
One that gradually took the ice from her veins and relaxed her until she felt as _ as a bug and ready to purr like a kitten,close,she,bug,felt,soft,fun,elastic,close,3
They moved together in a dance as _ as time until finally Travis slid between her parted thighs hands going to her hips to hold her tightly against him and feel his desire,old,They,time,moved,long,fun,old,young,2
Ruth was as _ as a dolphin in the water and she was away from him before he had a chance to stop her,agile,Ruth,dolphin,was,valuable,agile,reluctant,cunning,1
Did I accuse you of being as _ as nails he teased gently at last as if reading her mind,hard,you,nails,being,sick,beautiful,grey,hard,3
She was as _ as rain two days ago Jenny said and she was well all winter,right,She,rain,was,wet,incorrect,right,wrong,2
John Power is prepared to run through a wall Willie O'Connor is as _ as nails and Liam Simpson takes no prisoners,hard,O'Connor,nails,is,sharp,hard,easy,soft,1
The picturesque village seems as _ as the series at first sight,surreal,village,series,seems,surreal,impossible,complex,peaceful,0
Baby Bogdan on road to recovery ROMANIAN baby Bogdan Ursu is as _ as a button in Middlesbrough General Hospital after last week 's operation to remove water from his brain,bright,Bogdan,button,is,green,red,bright,dark,2
Shreeves said Gary could be as _ as a button on Monday but I felt we had to let Graham Taylor know,bright,Gary,button,be,red,dark,bright,green,2
The gulf in class was as _ as the Mersey after the break but the first - half belonged to Sunderland,wide,gulf,Mersey,was,skinny,narrow,wide,thin,2
The beast is about as _ as a sheep and is described as A freak of nature,big,beast,sheep,is,big,little,good,small,0
What larks and japes persuaded this audience to collapse in convulsions is a mystery which is as _ as the Druids ' Runes,dark,mystery,Runes,is,dark,light,beautiful,cryptic,0
This work with great and powerful climaxes in first and last movements with a scherzo which is as _ as thistledown a truly poetic slow movement and tremendous pageantry in the finale is much more than a series of vignettes of a great city,light,scherzo,thistledown,is,light,fun,cryptic,unpleasant,0
SUSAN Finley had to be as _ as nails to secure a top job aboard a luxury cruise liner,tough,Finley,nails,be,soft,tough,weak,sharp,1
I have n't been on the stage for a long time so I 'm bound to be as _ as a kitten before I go on,nervous,I,kitten,be,hungry,thirsty,skinny,nervous,3
Even if you 're as _ as a master they still wo n't give you the top black,good,you,master,'re,bad,old,good,important,2
I mean now they 're as _ as thieves you know,thick,they,thieves,'re,thick,slim,thin,petty,0
so er cos me heart was in me mouth when they come up for Christmas and that 's the last time they were up I thought me tree 's gon na go over you know I thought if he pulls at me tree or anything but he was he was as _ as gold for not he was n't trying to get me ornaments or anything he was er you know just happy to play with his own toys so he was n't naughty,good,he,gold,was,bad,happy,good,dead,2
But she was as _ as a kitten because we were we were in a one of these Canadian type er,nervous,she,kitten,was,hot,nervous,weak,skinny,1
It has often been claimed that English speech is rhythmical and that the rhythm is detectable in the regular occurrence of stressed syllables of course it is not suggested that the timing is as _ as a clock the regularity of occurrence is only relative,regular,timing,clock,is,slow,regular,irregular,random,1
As soon as I found out I had to retire they were as _ as gold and granted me a testimonial straight away,good,they,gold,were,old,good,bad,different,1
I 'd be as _ as a dog with two dicks,happy,I,dog,be,sad,fun,unhappy,happy,3
The Derby defence looked as _ as a tea - bag but Penney fluffed the shot,solid,defence,bag,looked,solid,hollow,heavy,FALSE,0
He may be as _ as a dinosaur but he 's as gentle as a lamb,tough,He,lamb,be,soft,easy,tough,weak,2
Without the pioneering treatment Jonathon would have been as _ as youngsters half his age,tall,Jonathon,youngsters,been,short,tall,competitive,small,1
Oh I see what you mean no I do n't think he 'll come home as _ as a button somehow or other,bright,he,button,come,dull,dark,bright,green,2
I remember as _ as day standing talking to Penny and I was calling their plumber I 'll always remember that and er I was quite took back and Penny said ooh she 's been very good to me,clear,I,day,remember,clear,right,light,bright,0
That sat as _ as gold till you got to Colin 's did n't he,good,That,gold,sat,bad,ill,good,pure,2
Yeah but when he got down here he was as _ as rain was n't he,right,he,rain,was,incorrect,FALSE,wrong,right,3
You know she 's as _ as gold and all that but I mean,good,she,gold,'s,good,pure,hot,bad,0
Everywhere there is delicious coffee served very strong and black in little cups it is either free or costs about 2p and seems as _ as water here,common,coffee,water,seems,impossible,common,rare,uncommon,1
George was a quick thinker so always did the introducing and all of the talking but George did not talk about himself he told of how Lennie was as _ as a bull and how he could buck barley all day,strong,Lennie,bull,was,funny,slow,weak,strong,3
He felt for the words that should follow the first step that was as _ as a death or more truly as _ as being born again,hard,step,death,was,soft,hard,easy,bad,1
England 's batting in this Test has been as _ as the plate of prawns which ruled out captain Graham Gooch,unsafe,batting,plate,been,unsafe,square,rectangular,hollow,0
Together under Caroline Paterson 's skilled direction the company finds an idiom for a humour which is as _ as an arrowhead and as hard as flint and a style for an emotion which is shaped from the very suppression and denial of feeling,sharp,humour,arrowhead,is,black,sharp,flat,dull,1
At the moment the number of people suffering from flu in Scotland is nowhere near those levels but one or two football managers may well be feeling as _ as a parrot because they did not think to have their highly - priced investments vaccinated before the winter began,sick,managers,parrot,feeling,bad,sick,healthy,good,1
You may remember that Samson was a man of enormous strength and then following a liaison with Delila and her cutting off his hair he was reported to have become as _ as a child and yet there was an occasion which led to his death when he brought the whole temple down by pulling the pillars against which he was propped,weak,he,child,become,old,strong,drunk,weak,3
The French monarchy probably benefited little from this horde of officials who lay in the words of a contemporary Englishman which are as _ as the grasshoppers in Egypt,thick,words,grasshoppers,are,thin,sparse,thick,slim,2
You will be as _ as a piece of dirt on the sole of my shoe,worthless,You,piece,be,useful,solid,valuable,worthless,3
Under water their needle - like razor - sharp teeth enable them to take fish as _ as eels through they are not good enough swimmers to prey regularly on the fast - swimming fish such as salmon or trout,slippery,them,eels,take,dangerous,sticky,slippery,glossy,2
Robert Giroux has recalled how in advance of such occasions Eliot was as _ as a cat but that when he had begun a great calm descended upon him,nervous,Eliot,cat,was,thirsty,wild,lazy,nervous,3
Such solitariness was a condition and not a mood however it lay beneath those moments of inexplicable high spirits when Eliot seemed as Sherek put it as _ as a cricket just as it could be combined with apparent activity and busyness in the world,gay,Sherek,cricket,put,black,mammal,funny,gay,3
In some parts they are grouped in swarms hundreds strong as _ as herds of grazing antelope,thick,swarms,antelope,strong,thin,hard,slim,thick,3
Moreover he was chuckling and making humorous observations to Fleury in Hindustani his eyes gleaming as _ as anthracite pointing at his neck occasionally and shaking his head as if over an unusually successful jest,black,eyes,anthracite,gleaming,black,hot,blue,green,0
They had a good supper of eggs and milk and crunchy fresh bread in the kitchen which was as _ as the rest of the house but more cheerful with a big range fire that threw out heat like a furnace,clean,kitchen,rest,was,dirty,short,clean,open,2
Writing of the work of Chardin whose most profoundly moving paintings are revelations of how trivial homely everyday scenes and objects are transformed for us when we see them through the eyes of a great painter Proust says Chardin has taught us that a pear is as _ as a woman a kitchen crock as beautiful as an emerald,living,pear,emerald,is,out,living,open,enjoyable,1
