sentence,topic,vehicle,event,option0,option1,option2,option3,human_idx,ans_idx
This is in a society that believes a thought is as _ as the deed .,thought,deed,is,legal,real,imaginary,fake,1,1
"The dialogue is as _ as the characters , with a lot of vernacular that is specific to a certain era in New Orleans .",dialogue,characters,is,fun,funny,colorful,complex,3,2
"Unfortunately , the main character ( Andrea Sachs ) is as _ as flat soda .",character,soda,is,complex,sticky,bland,sweet,2,2
The Cat Empire is truly an original band in a time when true originality is as _ as the raw talent they possess !,originality,talent,is,available,scarce,abundant,common,1,1
"The storyline , however sparse , is as _ as the mathematics - albeit quite nineteenth-century'ish in tone .",storyline,mathematics,is,boring,interesting,fun,useful,0,1
Huether's and McCance's book is as entertaining and _ as a root canal .,book,canal,is,expensive,painful,noisy,deep,3,1
"If all his work is as _ as this enchanting story , I'm hooked on MacDonald .",work,story,is,good,fun,funny,bad,2,0
"The words of the narrator are as _ as his sight , and he describes for pages and pages the dialogues and behaviours that take place during such encounters .",words,sight,are,few,reflective,thorough,thrilling,2,2
the day was as _ as a flame of a candle .,day,flame,was,perfect,wrong,modern,imperfect,0,0
The quality of the printing and editing is almost as _ as the absurdity of the unsubstantiated claims with which the two writers fill page after page .,quality,absurdity,is,amusing,funny,annoying,useful,2,2
"Jazz and her twin , Jess , are as _ as night and day .",twin,day,are,normal,single,different,bright,2,2
Chain is as _ as its weakest link,Chain,link,is,heavy,strong,new,weak,3,1
"Mama May lived where the earth met the sky , and her house was as _ as the prairie .",house,prairie,was,thin,wide,big,narrow,1,1
"The murder story was not as _ as the glimpses into the society of the time , but the author gives you a well-rounded view of both the top and bottom segments of New York .",story,glimpses,was,interesting,sharp,funny,boring,0,0
realism is as _ as it's protagonist,realism,protagonist,is,mute,funny,creative,entertain,2,0
"Afterwards , your pieces are almost as _ as sunshine .",pieces,sunshine,are,warm,dark,dull,bright,3,3
"His own death would give us the freedom to see inside his life , inside his journals where his ability to place his adventures on the page is as _ as any assemblage artist that comes to mind .",ability,artist,is,artistic,fascinating,useful,creative,0,1
"For a brief moment , in the pulse of her flesh all Lucas Corso's previous deaths came to life , as if brought by the current of a dark , slow river whose waters were as _ as varnish . """,waters,varnish,were,shallow,thick,thin,sparse,1,1
Often the explanations are as _ as mud .,explanations,mud,are,muddy,clear,free,unclear,3,1
"As you progress , your ankles become as _ as rocket boosters and your feet will act as mini-trampolines .",ankles,boosters,become,powerless,solid,powerful,dangerous,2,2
"I think the appeal is that the stories are about things young children can relate to , and often have experience of , and the hapless sheep find the world as _ as little ones often do .",sheep,ones,find,dense,new,difficult,surprising,2,3
"CONSTANTINE , FOR TANITH Here in the moonlight , raise your sword and dance : Edges strike notes as _ as any star , Sweet crystal clarity no blood could mar , Meet me in war or love , and take this chance .",Edges,star,strike,bright,dark,loud,sharp,0,0
"First went our fat , and after the leane , Next at our selves they draw their Skeene ; Our Market being spoiled thus on the Land , And troubles increase as _ as the sand .",troubles,sand,increase,thin,sparse,thick,soft,3,2